Type,Name,Description,Price,Contains,Image
Desert,ice-cream,cold,3.5,Milk,/images/Desert/d02.jpg
Desert,Fried Cheese Cake,"Cheese cake wraps with cinamon, suar dusting, topped with raspberry sauce",6.5,Dairy,/images/Desert/d03.png
Desert,Warm Apple Crumbel,Served with vanila ice-cream,6.5,Dairy,/images/Desert/d04.jpg
Desert,Chocolate Brownie,Served with vanila ice-cream,6.5,Dairy,/images/Desert/d05.jpg
Desert,Melt in the middle chocolate Fondant,Served with vanila ice-cream,7.5,Dairy,/images/Desert/d06.jpg
Desert,Salted Caramel Protiferoles,"Profiteroles with a sweet caramel coating, filled with a delicately salted caramel cream",7.95,Dairy,/images/Desert/d08.jpg
Desert,Honeycomb Cream Slice,Sweet honeycomb and chocolate pieces in a light creamy topping on a layer of salted caramel and crunchy biscuit,7.95,Dairy and wheat,/images/Desert/d09.jpg
Desert,Vanilla Cheesecake,"Vanilla cheesecake on acrumbly biscuit base, served with fruit coulis",7.95,Dairy and wheat,/images/Desert/d10.jpg
